{
  "kind": "alignment-table",
  "languagePair": {
    "sourceLanguage": "fr",
    "sourceScript": "Latn",
    "targetLanguage": "ar",
    "targetScript": "Arab"
  },
  "parallelId": "tatoeba-fr-ar-2026-06-06",
  "schemaVersion": "1",
  "units": [
    {
      "metadata": {
        "artifactDescriptor": {
          "artifactId": "artifact:textpack-fr-parallel:full:tatoeba-fra-ara-links:2026-06-06",
          "cacheKey": "tatoeba-fra-ara-links-tsv-bz2-2026-06-06",
          "checksum": {
            "algorithm": "sha256",
            "value": "43d9b95ed2b74940e3767915ae8ada2b6e5e83e83f5c96f589e4fb83f6492b30"
          },
          "compression": "bzip2",
          "expectedFiles": [
            {
              "checksum": "sha256:43d9b95ed2b74940e3767915ae8ada2b6e5e83e83f5c96f589e4fb83f6492b30",
              "path": "fra-ara_links.tsv.bz2",
              "sizeBytes": 19399
            }
          ],
          "licenseExpression": "CC-BY-2.0-FR",
          "mediaType": "text/tab-separated-values",
          "profile": "full",
          "redistributionPolicy": "redistributable-with-attribution",
          "retrieval": {
            "instructions": "Fetch explicitly from Tatoeba weekly exports and verify the SHA-256 checksum before unpacking or indexing.",
            "kind": "https",
            "uri": "https://downloads.tatoeba.org/exports/per_language/fra/fra-ara_links.tsv.bz2"
          },
          "sizeBytes": 19399,
          "sourceIds": [
            "source:tatoeba:weekly-french-2026-06-06"
          ],
          "version": "2026-06-06"
        },
        "artifactId": "artifact:textpack-fr-parallel:full:tatoeba-fra-ara-links:2026-06-06",
        "checksum": "sha256:43d9b95ed2b74940e3767915ae8ada2b6e5e83e83f5c96f589e4fb83f6492b30",
        "etag": "\"6a23c014-4bc7\"",
        "lastModified": "Sat, 06 Jun 2026 06:37:08 GMT",
        "licenseExpression": "CC-BY-2.0-FR",
        "path": "fra-ara_links.tsv.bz2",
        "rowCount": 3015,
        "sourceId": "source:tatoeba:weekly-french-2026-06-06"
      },
      "unitId": "fra-ara-links-2026-06-06"
    }
  ]
}
