{
  "kind": "alignment-table",
  "languagePair": {
    "sourceLanguage": "ar",
    "sourceScript": "Arab",
    "targetLanguage": "es",
    "targetScript": "Latn"
  },
  "parallelId": "tatoeba-ar-es-2026-06-06",
  "schemaVersion": "1",
  "units": [
    {
      "metadata": {
        "artifactDescriptor": {
          "artifactId": "artifact:textpack-ar-parallel:full:tatoeba-ara-spa-links:2026-06-06",
          "cacheKey": "tatoeba-ara-spa-links-tsv-bz2-2026-06-06",
          "checksum": {
            "algorithm": "sha256",
            "value": "45620b4d7e1b2ddfae38b95b060d557940c10dd3c16055e870dd92720d3019bc"
          },
          "compression": "bzip2",
          "expectedFiles": [
            {
              "checksum": "sha256:45620b4d7e1b2ddfae38b95b060d557940c10dd3c16055e870dd92720d3019bc",
              "path": "ara-spa_links.tsv.bz2",
              "sizeBytes": 21075
            }
          ],
          "licenseExpression": "CC-BY-2.0-FR",
          "mediaType": "text/tab-separated-values",
          "profile": "full",
          "redistributionPolicy": "redistributable-with-attribution",
          "retrieval": {
            "instructions": "Fetch explicitly from Tatoeba weekly exports and verify the SHA-256 checksum before unpacking or indexing.",
            "kind": "https",
            "uri": "https://downloads.tatoeba.org/exports/per_language/ara/ara-spa_links.tsv.bz2"
          },
          "sizeBytes": 21075,
          "sourceIds": [
            "source:tatoeba:weekly-arabic-2026-06-06"
          ],
          "version": "2026-06-06"
        },
        "artifactId": "artifact:textpack-ar-parallel:full:tatoeba-ara-spa-links:2026-06-06",
        "checksum": "sha256:45620b4d7e1b2ddfae38b95b060d557940c10dd3c16055e870dd92720d3019bc",
        "etag": "\"6a23c013-5253\"",
        "lastModified": "Sat, 06 Jun 2026 06:37:07 GMT",
        "licenseExpression": "CC-BY-2.0-FR",
        "path": "ara-spa_links.tsv.bz2",
        "rowCount": 3360,
        "sourceId": "source:tatoeba:weekly-arabic-2026-06-06"
      },
      "unitId": "ara-spa-links-2026-06-06"
    }
  ]
}
