{
  "kind": "alignment-table",
  "languagePair": {
    "sourceLanguage": "en",
    "sourceScript": "Latn",
    "targetLanguage": "el",
    "targetScript": "Grek"
  },
  "parallelId": "tatoeba-en-el-2026-06-06",
  "schemaVersion": "1",
  "units": [
    {
      "metadata": {
        "artifactDescriptor": {
          "artifactId": "artifact:textpack-en-parallel:full:tatoeba-eng-ell-links:2026-06-06",
          "cacheKey": "tatoeba-eng-ell-links-tsv-bz2-2026-06-06",
          "checksum": {
            "algorithm": "sha256",
            "value": "a711268471634a2b169c824a2fcdab336555d3a2d83a812bf8796ae3fcd8df08"
          },
          "compression": "bzip2",
          "expectedFiles": [
            {
              "checksum": "sha256:a711268471634a2b169c824a2fcdab336555d3a2d83a812bf8796ae3fcd8df08",
              "path": "eng-ell_links.tsv.bz2",
              "sizeBytes": 191418
            }
          ],
          "licenseExpression": "CC-BY-2.0-FR",
          "mediaType": "text/tab-separated-values",
          "profile": "full",
          "redistributionPolicy": "redistributable-with-attribution",
          "retrieval": {
            "instructions": "Fetch explicitly from Tatoeba weekly exports and verify the SHA-256 checksum before unpacking or indexing.",
            "kind": "https",
            "uri": "https://downloads.tatoeba.org/exports/per_language/eng/eng-ell_links.tsv.bz2"
          },
          "sizeBytes": 191418,
          "sourceIds": [
            "source:tatoeba:weekly-2026-06-06"
          ],
          "version": "2026-06-06"
        },
        "artifactId": "artifact:textpack-en-parallel:full:tatoeba-eng-ell-links:2026-06-06",
        "checksum": "sha256:a711268471634a2b169c824a2fcdab336555d3a2d83a812bf8796ae3fcd8df08",
        "etag": "\"6a23c014-2ebba\"",
        "lastModified": "Sat, 06 Jun 2026 06:37:08 GMT",
        "licenseExpression": "CC-BY-2.0-FR",
        "path": "eng-ell_links.tsv.bz2",
        "rowCount": 32318,
        "sourceId": "source:tatoeba:weekly-2026-06-06"
      },
      "unitId": "eng-ell-links-2026-06-06"
    }
  ]
}
