{
  "kind": "alignment-table",
  "languagePair": {
    "sourceLanguage": "fr",
    "sourceScript": "Latn",
    "targetLanguage": "en",
    "targetScript": "Latn"
  },
  "parallelId": "tatoeba-fr-en-2026-06-06",
  "schemaVersion": "1",
  "units": [
    {
      "metadata": {
        "artifactDescriptor": {
          "artifactId": "artifact:textpack-fr-parallel:full:tatoeba-fra-eng-links:2026-06-06",
          "cacheKey": "tatoeba-fra-eng-links-tsv-bz2-2026-06-06",
          "checksum": {
            "algorithm": "sha256",
            "value": "26cd42e6b219ecd016d6b5c38ace5a0b7285bf93da3a2cfa933f691341034689"
          },
          "compression": "bzip2",
          "expectedFiles": [
            {
              "checksum": "sha256:26cd42e6b219ecd016d6b5c38ace5a0b7285bf93da3a2cfa933f691341034689",
              "path": "fra-eng_links.tsv.bz2",
              "sizeBytes": 2630353
            }
          ],
          "licenseExpression": "CC-BY-2.0-FR",
          "mediaType": "text/tab-separated-values",
          "profile": "full",
          "redistributionPolicy": "redistributable-with-attribution",
          "retrieval": {
            "instructions": "Fetch explicitly from Tatoeba weekly exports and verify the SHA-256 checksum before unpacking or indexing.",
            "kind": "https",
            "uri": "https://downloads.tatoeba.org/exports/per_language/fra/fra-eng_links.tsv.bz2"
          },
          "sizeBytes": 2630353,
          "sourceIds": [
            "source:tatoeba:weekly-french-2026-06-06"
          ],
          "version": "2026-06-06"
        },
        "artifactId": "artifact:textpack-fr-parallel:full:tatoeba-fra-eng-links:2026-06-06",
        "checksum": "sha256:26cd42e6b219ecd016d6b5c38ace5a0b7285bf93da3a2cfa933f691341034689",
        "etag": "\"6a23c014-2822d1\"",
        "lastModified": "Sat, 06 Jun 2026 06:37:08 GMT",
        "licenseExpression": "CC-BY-2.0-FR",
        "path": "fra-eng_links.tsv.bz2",
        "rowCount": 435804,
        "sourceId": "source:tatoeba:weekly-french-2026-06-06"
      },
      "unitId": "fra-eng-links-2026-06-06"
    }
  ]
}
